科目,名稱,關鍵詞一,關鍵詞二,關鍵詞三,摘要
數學科,三角形與其外接錐線的生成錐線性質探討,有向線段比值和,二次曲線系,重心座標,"本研究源自三角形的重心及其外接圓所構作的線段比值的古老幾何性質，我們不但推廣原命題，還創造新命題：給定 ∆𝐴𝐵𝐶 與其外接錐線 𝛤，令直線 𝐴𝐺 , 𝐶𝐺分別交 𝛤 於 𝐴′,𝐵′,𝐶′ 點，再取任意 𝑘 值，探討 𝑃 點集合的性質。 主要研究發現為：（1） 𝛤3,𝑘 為二次曲線系，其橢圓、拋物線、雙曲線之形態不因 𝑘 值而改變，而是被外接錐線 𝛤 所決定。 （2） 發現 ∆𝐴𝐵𝐶 重心 𝐺、𝛤 中心 𝑂、𝛤3,𝑘 中心 𝑂3,𝑘 的共線性及比例常數。 （3） 完整劃分 𝛤3,𝑘 的非退化與退化型態，並發現只有 𝛤3,𝑘 為橢圓時，𝑘 值有跳躍現象。 （4） 發現錐線 𝛤 上取相異六點而生成兩個錐線 𝛤3,𝑘、𝛱3,𝑘 重合的充分條件。 最後，我們以「錐線 𝛤 上取一點、兩點到多點」的線性組合手法，推廣多邊形與其外接錐線的生成錐線 𝛤𝑛,𝑘 之性質。"
數學科,故態復「蒙」，「日」新月異 -Monge's theorem的性質探討與推廣,蒙日定理,射影幾何,共點共線,本研究以蒙日定理「平面上三圓彼此的外公切線交點共線」及其對偶定理「平面上三圓彼此的內公切線交點與另一圓的圓心的連線共點」出發，探討三圓更多由內、外公切線所產生的共點共線性質，進而探討四圓以上的情形，以及正多邊形、圓錐曲線等位似圖形，並推廣至空間中的球體。正如本研究作品名稱，我們將鮮少人研究的蒙日定理萌發出新枝，在日夜中茁壯，甚至最後有驚人的發現「在空間中n個外離的球，任意1個球的球心與另n-1個球的蒙日點連線會共交一點，此點稱之為n球的蒙日點」，此「點」發現，讓人不禁對宇宙中星體之間的關係產生更多無限的想像。
數學科,多方塊的塗色問題,多方塊,,,在本篇研究報告中，主要討論一個關於多方塊的問題：給定一個多方塊，試找出n的最小值使得在無限大的棋盤上，可以塗上n種顏色並且使多方塊沿格線無論如何放置，都不會蓋到重複的顏色。一開始先以V形三方塊的情況開始討論，之後將單方塊至五方塊的所有情況都有系統地討論完畢。 為了給出顏色數的估計，考慮同時適用於所有k方塊的情況。也就是說，要找到一個塗上n種顏色的無限棋盤使得無論任一個被選定的多方塊怎麼被放置在棋盤上，都不會覆蓋到相同顏色的格子。本篇研究成功地給出了此問題的精確解。 除了上面一種估計之外，本篇研究也考慮了矩形多方塊的顏色數，並試圖以之給出所有多方塊所需的顏色數之上下界。最後我得到k方塊所需的顏色數至多為8 25 (𝑘+1)2.
數學科,"動物大""關""園 ──探討與推廣特定限制下的組合問題 ",定距,排列組合,生成函數,"將1,2,...,n依序排成直線，任意取出k個數，取法數即為 n k C，但如果取出的k個數有限制，那問題就會有很多的變化。我們最先探討的是不含定距元素的直線與圓排列的組合問題，先從k中無任兩數相鄰，再將問題一般化成使得k中無任兩數之間隔為m。我們用分割的方法代替多數前人所採用的複雜的遞迴關係，求出取法數。 接著，我們推廣取法的限制，運用排列組合、排容原理、以及生成函數等做法，深入的探討各式各樣的組合數。"
數學科,格子直線數與歐拉函數之探討與推廣,格子直線,歐拉函數,法里序列,本研究在探討過原點且通過特定格子區域格子點的直線數；先討論正方形的區域，發現這樣的直線數與法里序列及歐拉函數有關，並使用這些結果得到三角形區域中的直線數。接下來，我們將上述問題從正方形區域推廣至高維度的(超)立方體區域，得到欲求的直線數，並介紹四個歐拉函數的推廣形式，其中一種是約當囿互質函數，使用這些函數不僅能簡化計算，更能拓寬歐拉函數的視野。最後，我們也計算單體區域，即高維度中廣義三角形區域中的直線數，這些結果成為法里序列的推廣形式，而我們所獲得的公式可以藉由第一類斯特林數表示。
化學科,透明有機發光元件,發光材料,有機發光二極體,透明顯示器,"本研究以熱激活化延遲螢光（Thermally Activated Delayed Fluorescence, TADF)材料之第三代有機發光二極體（OLED）為主軸，利用吖啶（acridine）作為電子予體、間位及臨位之雙CN苯環（phenylene, Ph）為電子受體，透過有機合成製備DMAC-m2CNPh及DMAC-o2CNPh分子。此外，我們檢測發現DMAC-o2CNPh具有極高的外部量子效率，並將此分子結合透明電極，經由熱蒸鍍製作出透明有機發光元件，探討元件的放光效率及應用性。本研究製作出吸光波長在可見光範圍外的分子，因此蒸鍍在透明基板上後可製作出透明的有機發光元件。將研究成果能應用在生活中，如展示櫥窗顯示新聞、汽車玻璃作為顯示器等，以期能夠提升生活的便利性及運用性。"
化學科,ELISA-SERS分析法應用於檢測卵巢癌前驅因子－結合球蛋白,酵素連結免疫吸附分析法,表面增強拉曼光譜,結合球蛋白,結合球蛋白(Hp)屬於一種急性反應期血清糖蛋白，目前廣泛作為預測卵巢癌的生物指標，檢測疑似卵巢癌腫瘤組織液中所含的Hp濃度，可判斷檢體是否為卵巢癌及是良性或惡性。 我們提出一種新穎的ELISA-SERS分析法，能靈敏地、可靠地定量分析結合球蛋白，首先競爭型ELISA反應得到黃色TMB2+，傳統的ELISA Reader 是測它在450 nm的吸光度而定量，而我們使用晶片及奈米金的表面增強拉曼光譜(SERS)，測TMB2+在1605 cm-1的拉曼訊號強度，將訊號強度對數值與Hp濃度對數值作圖，得到非常好的線性關係，其相關係數平方值R2大於0.99，可做為結合球蛋白(Hp) 的標準檢量線，非常精準地測出濃度介於20.0μg/mL至0.078 μg/mL的HP。臨床檢驗上，先將抽出的腹水的濃度稀釋為原來的千分之一，此時臨界值介於2.0 μg/mL–2.5 μg/mL，正好落在我們創新的ELISA-SERS分析法標準檢量線的適用濃度範圍。
動物學科,你在看哪裡 --蝌蚪眼睛位置及其視野之研究,蝌蚪,眼睛位置,視野範圍,陸域草食性動物的眼居於頭兩側，有較寬的單眼視野以便於逃避攻擊；而肉食性動物的眼居於頭前方，立體視覺較佳，有較好的距離感以捕捉獵物。我們利用Geogebra軟體分析台灣33種蝌蚪頭部影像資料，定位出每種蝌蚪眼睛的相對位置，並以數學幾何方式描繪眼睛的視野範圍。 我們發現蝌蚪眼睛位置可依兩眼距離分為“側位”(23%)、“背側位”(67%)及“背位” (10%) 三種型態。側位兩眼距較大，背位兩眼距較小。蝌蚪眼睛視野則可分為“前視型”(42%)及“側視型”(58%) 二種型態，前視型雙眼視覺區較大，側視型視野範圍較廣。我們將眼睛位置與視野範圍的數據與蝌蚪的棲息環境、食性種類及演化分類等進行相關分析，結果發現:1.眼睛位置與棲息環境有相關，棲息越接近水面，為「側位」；棲息越接近水底或是密閉空間，為「背位」。 2.視野範圍與食性種類有相關， 肉食性蝌蚪雙眼視覺角度較大，濾食性整體視野較廣。3.眼睛型態與物種演化關係大部分相符合，同一屬且生態棲位相似者，蝌蚪眼睛型態會相似，如台灣狹口蛙科Microhyla屬4種蝌蚪都是側位型；樹蛙科Kurixalus屬的3種蝌蚪都是背位型；但有些例外，如面天樹蛙眼位與同屬艾氏樹蛙不同，可能與生態棲位不同，而演化成不同的眼位有關。
動物學科,內皮素對稻田魚(Oryzias latipes)胚胎適應酸環境之調節,內皮素,稻田魚,酸調節,哺乳類的內皮素(endothelin-1 ; EDN1)與其受體endothelin receptor B己知可共同參與腎臟排酸功能之調節，在魚類的表現上，亦有研究指出EDN1會影響到斑馬魚的排酸。本研究中以廣鹽性魚種稻田魚(Oryzias latipes)仔魚為實驗對象，經6小時以上時間酸處理後其體表排酸量皆顯著增強，且經6小時酸處理後，仔魚rhcg1及內皮素受體EDNRA2的基因表現量也顯著增加，並發現當弱化(knockdown)仔魚的endothelin-1基因後，其體表排酸量顯著下降，證實endothelin-1對仔魚排酸作用有直接的影響。而當仔魚endothelin-1的基因表現被抑制後，其離子細胞密度以及離子通道蛋白基因表現不受影響，推測內皮素並非以增加離子細胞的方式影響排酸，而是藉由轉譯後調控途徑，使其排酸功能增強。另外本研究中再將6小時及7天酸處理實驗結果比對後，推測當稻田魚仔魚面臨短期或長期酸環境刺激時，內皮素調節機制亦略有不同。
動物學科,中樞神經節對美洲蟑螂步足反射的影響,美洲蟑螂,反射作用,中樞神經節,"本研究透過測量美洲蟑螂(Periplaneta americana)後足反射之程度與耗時等參數，探討中樞神經系統中各神經節在後足反射所扮演的角色。我們發現腦神經節對於反射作用有抑制與整合的效應，前胸神經節會增強反射，而後足的反射中樞位於中胸神經節與後胸神經節，腹部神經節則會抑制反射。本研究以電池座、釘書針與網路攝影機等簡單器材觀察、量化昆蟲足部反射運動，可推廣成國中生物中「反射」相關課程之行為觀察的探討活動。此外本研究也透過步足肌肉的肌肉電位圖(electromyography, EMG)記錄，證實了腦神經節在步足反射過程中具有調控功能。本研究的成果可應用在仿生醫療上，有助於術後復健或輔具製造的相關研究。"
生物化學科,以蛋白質體學方法鑑定人類肝癌細胞經蕾莎瓦治療之預後的潛力生物標記,肝癌,生物標記,蕾莎瓦,肝癌是死亡率極高的癌症。目前並無非侵入性方法判斷標靶藥物治療效果。蕾莎瓦(Sorafenib)是一種使用於肝癌晚期治療的標靶藥物，但有些病患在治療過程中會出現抗藥性，因此可預測蕾莎瓦治療效果的生物標記相當重要。 血液中的生物標記可及時追蹤疾病進展與預後之評估。本實驗利用質譜法鑑定分析在肝癌細胞(HuH7)中加入蕾莎瓦模擬治療後肝癌的分子機轉，並透過生物資訊軟體了解蛋白質在HuH7細胞中所扮演的角色。我們發現Galectin-3 和HMGB1可能參與腫瘤細胞的增生和遷移，以西方墨點法觀察其表現量，發現Galectin-3 和HMGB1在受到藥物處理後，表現量皆有下降的情形。 蕾莎瓦可抑制B-RAF激酶進而阻斷MAPK pathway。MAPK pathway又可分成ERKs、JNKs和p38/SAPKs三類。為確認Galectin-3之訊息傳遞路徑，將蕾莎瓦和ERK抑制劑處理細胞，發現Galectin-3的表現量隨著時間而下降，證實Galectin-3的表現會受到ERK路徑調控。 Galectin-3與 HMGB1是極具潛力的生物標記可應用於蕾莎瓦的治療，希望這些生物標記可以應用在臨床上。
植物學科,粟之高禾─探討小米不為人知的耐鹽機密,小米,逆境,耐鹽,隨著全球氣候變遷，能在極端環境下生存的作物，是未來農業的救命藥。原住民種植的小米，具有在嚴苛環境下生長的特性。比較小米和水稻在鹽逆境的生長狀況，發現小米的根長、葉長及側根生長狀況都比水稻來的好，且小米具有花青素累積的現象。氣孔方面，小米在0.15%鹽濃度就能關閉氣孔，水稻則需到0.3%鹽濃度才會關閉。透過生化分析，發現小米在鹽逆境下抗氧化酵素與澱粉酶的活性皆比水稻高，此外小米亦能在鹽逆境下累積較多的脯胺酸與維他命 C，藉此提升小米的耐鹽能力。我們另比較小米與水稻對於淹水逆境的耐受性，結果顯示水稻在淹水逆境下地上部與地下部的生長狀況皆比小米佳，而淹水三天的小米仍無法在植株內累積脯胺酸來對抗淹水逆境，但外加脯胺酸卻能有效提升小米耐淹能力，另外水稻能透過形成通氣組織來增加淹水逆下根部的氣體交換，並能透過外加鈣離子來增加通氣組織的面積，但在小米則無此機制。透過實驗能讓我們了解作物抵抗逆境機制的優劣，期待未來能將結果運用於氣候變遷下的作物育種，造福全人類。
植物學科,文心蘭LhPRS基因參與花被發育調控之功能分析,文心蘭,PRS基因,花被發育,為了找出調控蘭花花瓣與唇瓣分化的基因，本研究分析文心蘭品系檸檬文心花瓣與唇瓣轉錄體之次世代高通量定序資料庫，篩選出一PRESSED FLOWER (PRS) 同源基因，命名為LhPRS。為了驗證 LhPRS 基因於花被之表現量，透過qRT-PCR 分析，顯示LhPRS 基因表現量集中在唇瓣，而在花萼與花瓣表現量較低，推測LhPRS對調控唇瓣發育有其重要性。為了進行後續基因功能性的分析，自唇瓣的cDNA選殖出LhPRS之編碼區序列，包含606個鹼基對，可轉譯出201個胺基酸。透過兩種不同系統之病毒誘導基因靜默技術，分析LhPRS基因表現被抑制時對文心蘭花朵發育之影響。結果發現當LhPRS基因在唇瓣表現量受到明顯抑制時，將使文心蘭花朵唇瓣形態產生變異而失去兩側對稱性，顯示LhPRS基因具有調控文心蘭唇瓣形態的分化並維持花被生長對稱性的功能。此研究發現將有助於應用在蘭花產業對花型調控與改造的需求上。
植物學科,新興汙染物銦對阿拉伯芥生長之影響 ,阿拉伯芥,銦,X光吸收光譜,銦之化合物常被應用於半導體產業當中，隨著使用量的增加也提高銦污染流佈於環境的風險，若此污染物流布至土壤並累積於植物體內，則可能通過食物鏈而影響人體的健康。現今國內外鮮少有銦對植物影響的相關研究，因此本研究以培養基試驗，探討銦對模式植物阿拉伯芥生長之影響。結果顯示，當銦處理濃度為500 µM時，其生質量以及根長會受到抑制。MDA含量的增加，顯示銦會對阿拉伯芥造成氧化逆境，而穀胱甘肽與金屬螯合素並非阿拉伯芥在銦逆境下主要的抗氧化機制。本研究亦發現銦處理下會影響對錳、鉀、鈉、磷、鐵、錳、銅以及鋅的吸收。此外，X光吸收光譜分析顯示根部以及地上部中銦物種有明顯組成上的差異。於根部有42.9%的銦是以吸附於細胞壁的形式存在，這可視為植物對重金屬所採取「隔離」策略的防禦方式之一。
植物學科,利用混沌系統偵測植物覺知人體之反應,植物電容,混沌系統,蔡氏電路,本研究證明用手觸摸植物或土壤時，會造成處於混沌狀態的蔡氏電路發生電位相圖的改變，經由微調並聯在模擬線路電源端的可變電容來比對相變過程，可以測量到非常微小的等效電容變化量。不同於傳統透過改變電阻來實現混沌行為的方法，證實本研究假設確實存在且具應用價值。 我們透過改變電極接點、電路初始狀態、人體靠近或觸摸不同部位等方式，探討兩種植物因微擾所產生的相變。結果發現微擾植物與其棲地時會產生「混沌制抑」的現象，整體系統的電容變動範圍界於0到100pF之間。更重要的是，本方法還可以偵測到微擾遠端植物時經根系及土壤同步產生的電容變化訊號，這是一般電容計所感測不到的。 利用混沌行為的特性，可以應用於偵測與分析生物體或宇宙間微弱且複雜的訊號，不需經由訊號轉換或放大等的處理程序，是本研究的重大發現，未來極具發展潛力。
植物學科,阿拉伯芥茉莉酸結合酶FIN219參與生物韻律變化之研究,FIN219,生物韻律,茉莉酸,生物韻律與植物許多生長過程息息相關，其機制是生物學中重要的研究主題。FIN219能夠活化茉莉酸，進而引發植物對於逆境的防禦能力，也參與了藍光的訊息傳遞鏈，與植物的開花有關聯，其表現在長日照環境下也具有以24小時為週期的變化，因此很有可能參與了生物韻律的調控。本研究以GUS染色、西方墨點法與RT-PCR進行實驗，發現阿拉伯芥的FIN219基因與其蛋白質進入照光期後表現量會增加，進入黑暗期則會減少，此生物韻律也會受到外加JA與JA合成抑制劑DIECA的影響。再以RT-PCR比較生物韻律相關基因在野生種與剔除FIN219基因的突變株中的表現，也發現FIN219基因沒有表現時，相關基因TIC、TOC1、CAB2、CAB3、RBCS-1A和JAZ1表現的生物韻律會減弱。因此可知FIN219不但能夠增進植物的防禦能力，其引發的訊息傳遞也參與了生物韻律的調控機制。
微生物學科,迪化汙水處理廠降解雌激素之菌種純化,雌激素,迪化汙水處理廠,,雌激素為一種固醇類的環境賀爾蒙，若水生動物長時間暴露於低濃度的雌激素中，即會導致其生理及行為異常。我們企圖從迪化汙水處理廠中分離純化出能有效降解雌激素之菌株，希冀了解這些菌株的生理特性與降解雌激素的能力。首先在活性污泥中加入高濃度雌二醇(1mM)，以增進雌激素降解菌在菌群中的比例，接著利用十倍序列稀釋進行菌株純化。培養期間以薄層層析檢測雌激素降解活性。隨後以固態培養基培養法取得單一菌落，並進行聚合酶連鎖反應及核酸定序。之後我們亦將純化出之菌株進行其他固醇降解測定。目前純化出一株Novosphingobium屬的變形菌，其為一新的菌種，確實能降解雌二醇及其他固醇，包含雌酮、雄烯二酮、膽酸、孕酮和睪酮。然而，其並不能降解乙炔雌二醇。該菌株具有修復受汙染環境及製備雌激素相關藥品之應用潛力。
微生物學科,除油利器，天然的最好 --環境中具降解油汙能力之微生物研究,嗜油菌,降解,油汙,目前研究的嗜油菌主要是分解石油(碳氫化合物)，不過從生活中所排出的油(三酸甘油酯)，也是一大污染源。本研究目的為篩選可分解三酸甘油酯之微生物，並探討其特性及降解油污的能力。從有油污的環境分離出三種對於日常生活中的油污具降解效果的菌株，利用16S ribosomal RNA gene進行菌種分析鑑定為Ralstonia sp.TFD41、Pseudomonas putida strain II-B、Sphingomonas sp.NC110。Ralstonia sp.TFD41較佳的生長環境為30℃、pH8，偏鹼，革蘭氏陰性菌；Pseudomonas putida strain II-B較佳的生長環境為30℃、pH6-10，偏鹼，革蘭氏陰性菌；Sphingomonas sp. NC110最佳生長環境為30℃、pH4-8，偏酸，革蘭氏陰性菌。而菌種在炸時越長的油中生長情形越差。而在家庭污水中的生長菌數最多的為Sphingomonas sp.NC110M。放入1000ppm油的培養基中，以Sphingomonas sp.NC110的降解油污的能力為最佳、Ralstonia sp.TFD41的降解速度最快。在家庭汙水中Ralstonia sp.TFD41 + Pseudomonas putida strain II-B的生長狀況最穩定。未來預期能培養嗜油菌，將其放回環境中，降解環境中的油汙，以減少油汙對於環境的汙染，還給生物乾淨的生活環境。
醫學與健康科學科,幾丁寡醣對藍光LED造成視網膜色素上皮細胞傷害的保護作用,視網膜色素上皮細胞,藍光,轉錄因子,"3C 產品及LED燈多以藍光照明，長期照射易導致視網膜黃斑部病變。其作用機轉是藍光引起視網膜細胞過氧化物質 (ROS)增加，造成細胞的氧化壓力進而引發細胞凋亡。幾丁寡醣 (Chitosan oligosaccharides, COS) 藉由減少自由基產生和抑制轉錄因子NF-κB傳導路徑而有抗氧化及抗凋亡的作用。 本研究以ARPE-19細胞株，在添加不同濃度的COS下，經照射LED藍光處理後，分析色素上皮細胞活性、ROS表現量及細胞凋亡情形，並透過PCR、西方墨點法、JC-1及免疫螢光染色分析作用機轉。實驗證實COS能抑制過氧化物質 (ROS)的產生，減少視網膜色素上皮細胞因藍光所造成的細胞凋亡。PCR和西方墨點法的結果顯示COS可以抑制發炎介質HO-1、iNOS、Caspase-3、Bcl-2、ERK，及基因iNOS、MCP-1的產生。免疫螢光染色顯示COS能抑制NF-kB核易位。總結來說，COS能藉由抑制NF-kB的活性，減少其下游基因的表現量，降低細胞氧化壓力和發炎反應來避免視網膜色素上皮細胞損傷。COS在臨床上有潛力成為一種預防LED藍光造成視網膜傷害的有效保健食品。"
醫學與健康科學科,葉酸缺乏及葉酸補充調控乳癌細胞轉化成癌幹細胞並促進體外腫瘤形成,葉酸缺乏及補充,乳癌幹細胞,腫瘤球生長,研究指出葉酸營養狀態與乳癌的風險有相互關聯且癌幹細胞是扮演癌症轉移的主要角色。葉酸缺乏和葉酸補充皆能促進癌細胞的轉移。本研究探討葉酸營養不良和葉酸補充是否會促進乳腺癌細胞轉變成癌幹細胞，將乳癌細胞株養於正常葉酸、低葉酸和高葉酸中，藉以模仿癌症病人的葉酸營養狀態。細胞在每個葉酸濃度中培養2、 4 、 8 天後再培養於腫瘤球體培養液中並測量四種幹細胞標記-mTOR，SHH，Sox2和Nanog。結果顯示:低葉酸會導致癌細胞的生長停滯，藉由標記的表達增加顯示長期低葉酸會促進細胞轉變成癌幹細胞。於腫瘤球體培養液時，低葉酸組亦較對照組於體外產生較大及較多的腫瘤球。高葉酸組會加速癌細胞的增殖和向癌幹細胞的轉變且細胞增生較快並表達較多的標記，其腫瘤球體亦是最大和豐富的。總之，低葉酸和高葉酸都增強了乳腺癌細胞的腫瘤生成和轉變成癌幹細胞。
醫學與健康科學科,探討rVP1在肺癌細胞上Integrin路徑及Wnt/β-catenin路徑的作用機制,rVP1,Integrin路徑,Wnt/β-catenin路徑,經基因重組技術純化的口蹄疫病毒鞘蛋白rVP1被證實在癌細胞內會經由Integrin 路徑對癌細胞的轉移及凋亡產生影響。本研究所探討的是rVP1對肺癌幹細胞H1299及肺癌細胞A549中Integrin路徑與Wnt/β-catenin路徑的作用機制，目的除了要了解兩路徑在肺癌細胞中的影響，也希望能找出兩路徑的交互作用機制。 本研究發現肺癌幹細胞H1299中β-catenin會因加入rVP1而表現量下降，與肺癌細胞不同；肺癌細胞A549中Wnt/β-catenin 路徑上游的膜上受體Frizzled-8 因 rVP1 作用而表現量下降；而不論在肺癌幹細胞H1299及肺癌細胞A549 中Grb2都不會因rVP1作用而表現量有所改變；Wnt/β-catenin 路徑下游產物MIG-7則會因加入Wnt3a ligand而表現量下降。  由實驗結果推測癌症幹細胞本身與癌細胞特性不同，可能使得Wnt/β-catenin路徑產生的效果不同；Grb2的變化量則需要更多實驗求證。Integrin路徑會影響到Wnt/β-catenin 路徑的上游生成，兩者確實有相互影響。
醫學與健康科學科,魚腥草對攝護腺癌及胰臟癌之影響,魚腥草,癌症,蛋白酶,治療癌症通常以化學治療為大宗，但化療會帶來副作用，因此目前研究以溫和草藥來取代化療。在治療癌症時，癌症轉移會使病人存活率下降，因此如果找到能抑制癌症轉移的藥物，就能提高病人的存活率，而在癌症轉移機制中，癌細胞要轉移時會分泌蛋白酶，降解基底膜和細胞外間質，使癌細胞轉移出原位組織。本研究聚焦於魚腥草是否能抑制攝護腺癌細胞及胰臟癌細胞侵襲其他組織、降低基質金屬蛋白酶(matrix metalloproteinase;以下簡稱MMP)的基因量及活性及降低細胞中尿激酶型纖溶酶原激活劑(urokinase plasminogen activator ;以下簡稱uPA)表現量。根據實驗結果，魚腥草可能藉由降低MMP的基因量以抑制攝護腺癌細胞的侵襲能力及遷移能力，但抑制胰臟癌細胞MMP的活性不是藉由降低MMP的基因量，且魚腥草並不會降低兩種癌細胞的uPA表現量，但由於先前加了HCE的癌細胞轉移能力下降，因此我們認為魚腥草在不影響癌細胞的生長下，仍然可抑制兩種癌細胞的轉移能力。
