科目,名稱,關鍵詞一,關鍵詞二,關鍵詞三,摘要
化學科,摻鈀鹵氧化鉍奈米晶體光催化還原二氧化碳,鹵氧化鉍,光催化,二氧化碳還原,本研究將以BiOCl、BiOBr以及Pd/BiOCl的晶體製備二氧化碳還原之光觸媒，用以還原二氧化碳，期許能製造出具有經濟價值的還原產物，以緩解全球暖化並利用可再生能源。此外，我們藉由探討此類晶體在二氧化碳還原中的差異，比較加入不同鹵族元素及是否摻入鈀金屬對於光催化還原二氧化碳效率及產物的影響。 合成晶體後，我們透過X射線衍射儀(XRD)、掃描式電子顯微鏡(SEM)、能量散射X射線譜(EDX)進行晶體的鑑定，也確定Pd/BiOCl的晶體結構是以BiOCl為主體，且Pd鑲嵌在其表面。我們也以X光光電子能譜儀(XPS)了解晶體的鍵結型態及推測不同晶體表面的OVs相對含量，並以紫外光/可見光光譜儀(UV-vis)檢測樣品的能隙，推測其光催化性能。  我們發現摻入鈀的BiOCl晶體結構為分散的片狀結構，是三種晶體中唯一的奈米晶體，且能隙為三者中最小(2.46eV)、表面OVs含量也增加；表面附著的Pd奈米金屬顆粒更可以協助主催化劑的電子-電洞對維持分離狀態，促進其光催化效率。 最後我們將合成的BiOCl、BiOBr以及Pd/BiOCl晶體應用於光催化還原二氧化碳，並以氣相層析熱導偵測器(GC-TCD)及氣相層析質譜儀(GC-MS)檢測產物種類及產率，發現還原出的氣體產物有H2、CO、CH4。而總還原產物及含碳還原產物的產率皆以Pd/BiOCl為最高。
化學科,分子拓印修飾磁性奈米粒子萃取福壽螺卵中蝦紅素之探討,蝦紅素,分子拓印,福壽螺,本研究以二氯化鐵和三氯化鐵所合成之磁性奈米粒子為基底，包覆上以蝦紅素為模板修飾的二氧化矽，製作出具有蝦紅素專一性的磁性奈米粒子，應用於萃取福壽螺卵中之蝦紅素。利用干擾物證明磁性奈米萃取粒子具有蝦紅素的專一性，再探討奈條件的影響。福壽螺卵經過打碎離心後，依序加入0.2 M氫氧化鈉及米粒子合成及萃取1 mM鈉，使蝦紅素水解並去脫去蛋白質轉換為游離態。當模板濃度為0.0 5十二烷基硫酸9 mg/mL、TEOS 1.892 mg/mL和蝦紅素的濃度為0.07 mg/mL時，會有最佳的萃取率達60.7 %濃度為。此磁性奈米粒子在萃取步驟後，再以丙酮進行脫附，至少重複使用3次。此技術可減少福壽螺的農害，也極具經濟價值，很值得研究。
化學科,單分散原子電催化二氧化碳還原,單分散原子,二氧化碳還原,,近年來碳排放的淨零是全人類所想達成的共同目標，因此本研究以電催化劑幫助二氧化碳還原反應進行，降低反應所需電壓，同時提升產一氧化碳的法拉第效率。本研究一共嘗試兩種易於合成的材料作為催化劑前驅物，分別是沸石咪唑骨架和類石墨相氮化碳，搭配三種非貴金屬鐵、鈷、鎳配位合成催化劑。用X光繞射儀、掃描式電子顯微鏡以及能量色散X射線光譜儀鑑定結構後，使用氣相擴散電極搭配三電極系統，進行電解還原二氧化碳的反應，並使用氣象層析儀分析產物及計算其法拉第效率。根據實驗結果，發現以類石墨相氮化碳為前驅物的鎳催化劑有最佳的一氧化碳法拉第效率，在電壓約-0.5V時接近99%，超越以往文獻所即的效率，且具有高專一性及能源轉換率，成本低，可商業化量產。若配合使用非化石的綠色能源來電催化還原二氧化碳，必能達成碳零排放的目標。
化學科,探討有機分子官能基對胰島類澱粉蛋白(IAPP)之影響,香豆素,胰島類澱粉蛋白,第二型糖尿病,過去許多文獻報導胰島類澱粉蛋白(islet amyloid polypeptide；IAPP)在體內的不正常聚集的現象，會造成分泌此賀爾蒙的β-細胞凋亡，間接導致胰島素分泌的下降，因此被認為與第二型糖尿病有高度的相關性。本研究利用不同官能基之香豆素(Coumarin)衍生物，測試其對胰島類澱粉蛋白之作用；實驗中成功合成高純度IAPP胜肽，再與香豆素衍生物(其光學特性已被檢測)進行混合，爾後進行硫磺素-T動力學試驗及穿透式電子顯微鏡觀察，我們發現某幾個香豆素衍生物確實會影響IAPP的聚集，再藉由圓偏光二色性光譜進一步瞭解有機分子對於IAPP聚集結構之影響，也利用分子模擬的方法來探討其如何與IAPP作用。 本實驗首創以香豆素作為基本骨架，探討官能基結構與IAPP間之交互作用，期待此研究成果可提供第二型糖尿病病症治療之契機與方法。
化學科,多工奈米複合材料合成與其協同治療應用,光治療,化學動力療法,CuFe2O4奈米材料,"本研究結合奈米合成技術及生物醫學應用，以牛血清蛋白（BSA）為載體，裝載具化學動力療法的金屬氧化物（CuFe2O4, CFO）及具光治療功能的光敏劑（IR780），製備CFO@BSA-IR780多功能奈米複合材料。     材料鑑定方面由TEM、DLS與UV-Vis等儀器進行組成及光學性質分析。特性方面，CuFe2O4在腫瘤環境由芬頓反應，促使H2O2產生活性極高的氫氧自由基（•OH）。並且IR780在近紅外光照射下同時具光熱與光動力治療特性，可殺死癌細胞。同時CuFe2O4中的Fe3+ 和Cu2+ 進行氧化還原將腫瘤部位的穀胱甘肽（GSH）轉化成氧化型穀胱甘肽，強化化學動力療法及光動力治療效果。     最後，本研究將CFO@BSA-IR780奈米材料實際運用於细胞毒性測試與細胞螢光顯影，確認其效果及低毒性。成功發展出同時具備化學動力療法、光動力治療、光熱治療及細胞螢光顯影之多功能奈米複合材料，期許在醫學治療提供一項新興藥物材料。"
化學科,"透過相轉移催化劑合成Chromeno[4,3-b] pyrrolidine 之衍生物",相轉移催化劑,"Chromeno[4,3-b]pyrrolidine",(3+2)環加成反應,"本研究之反應產物Chromeno[4,3-b]pyrrolidine之衍生物含有吡咯烷及二氫苯并哌喃的骨架，而此二者存在於許多藥物及天然物中，例如：尼古丁及蛋白質中的脯胺酸皆為吡咯烷的衍生物，含有二氫苯并哌喃骨架的藥物則通常被應用於消炎藥物中。本研究主要反應是以對甲基苯醌衍生物與亞胺葉立德前驅物在相轉移催化劑及無機鹼的催化下進行(3+2)環加成反應與oxa-1,6-加成反應，合成出Chromeno[4,3-b]pyrrolidine之衍生物。利用改變不同的相轉移催化劑、溶劑和無機鹼的種類及各反應物的當量數，篩選出進行本反應的最佳反應條件。在此優化條件下，進一步使用不同的掌性相轉移催化劑，以探討本反應之光學活性。並利用無機鹼的篩選，以排除背景反應發生的可能性。希望最後能於起始物上替換不同種類的取代基，以探討本反應之反應活性，並增加其未來應用的多樣性。"
化學科,定義酚基反應性：芳香環醣基受體之醣基化反應立體選擇性的預測及探討,酚,醣基化反應,立體選擇性,酚與苄基醇在許多領域中，被廣泛地運用以及探討，其中一重要的應用是與醣苷結合後可做為人們所服用的抗生素。儘管如此科學家卻尚未能將醇類結構中羥基的反應性量化來進行分析，因為缺乏準確的芳醇反應性數值，造成芳醇的研究與應用較難以掌握。因此本篇主要在進行芳醇反應性的量化。兩醇以競爭的方式進行反應後，再經動力學的計算，得到其相對反應性數值。進而再透過改變芳香環上的取代基來探討共振效應、誘導效應和立體效應對芳醇反應性之影響，並且將醇類之反應性數值與大數據分析結合應用於醣化學中，以探討並解決醣基化反應中立體選擇性控制之問題。
化學科,超分子奈米粒子應用於基因治療,超分子奈米粒子,CRISPR/Cas9,基因治療,X染色體關聯性視網膜裂損症患者，在青少年時期會逐漸喪失視力，主要是因為RS1基因突變造成視網膜剝離，目前並沒有藥物達到有效的治療效果，即使最新研發的病毒載體基因療法也沒有效果，雖然在動物模型中具有良好的表現，但是在人體試驗中卻沒有獲得任何顯著的改善成果，推測是實驗模型不夠完善，在本實驗中，我們將會採用幹細胞分化成為視網膜類器官，並搭配上超分子奈米粒子運輸基因編輯材料送入，期許達到治療效果。本研究中以超分子奈米粒子(SMNP)將CRISPR/Cas9基因編輯系統及正常RS1基因共同運輸進入細胞來達成基因敲入的效果。我們篩選出兩個具有最佳傳遞性之超分子奈米粒子載體(Cas9/sgRNAplasmidSMNPs及Donor-RS1/GFP-plasmidSMNPs)並將其應用於細胞中，於其安全編輯位點(AAVS1  locus)實施基因敲入，接著以PCR及Sanger sequence檢測敲入基因的正確性，並施以免疫螢光法分析RS1蛋白表現。結果顯示在細胞當中，RS1/GFP基因成功敲入AAVS1位點中並能有效進行表現，因此我們進而測試該方法是否能應用於iPSC分化而成的人類視網膜類器官中，其也成功表現RS1/GFP 質體引發的綠色螢光蛋白(GFP)，效果也持續接近40天。總而言之，我們希望目前的研究結果可以作為未來開發遺傳性疾病基因治療法的藍圖，造福受疾病所困擾的病患。
化學科,銠金屬催化劑應用於不對稱環化與chain walking之研究,銠金屬催化劑,不對稱環化,chain walking,本研究使用實驗室自製的配基與銠金屬結合為催化劑後，在一次使用銠金屬催化劑下，同時催化烯炔類與苯硼酸進行加成、不對稱環化、chain walking、以及消去反應，在保持鏡像選擇性下獲得具有末端烯的產物。透過改變鹼的加入方式、催化劑的種類等變因，篩選適合的反應條件。  實驗結果顯示，銠金屬催化劑能催化烯炔類與苯硼酸進行不對稱環化反應，最高產率可達88%且e.e.值可達86%。未來希望能將此反應路徑應用於其他不對稱合成，使銠金屬催化劑的應用達到省時、高效的目的，有助於天然物和藥物的研究發展。
化學科,活化石海百合Comanthus parvicirrus所含化學物質探討,Comanthus parvicirru,海百合,抗發炎,"本研究針對臺灣恆春半島海域所採集的棘皮動物海百合小卷海齒花Comanthus parvicirrus進行天然物化合物之成分研究，分離獲得三個角型萘並吡喃酮類型天然化合物，包括一個新化合物8-hydroxy-5,6,9,10-tetramethoxy-2-methyl-4H-benzo[h]chromen-4-one (1)以及兩個已知化合物comaparvin (2)與6-methoxycomaparvin-5-methyl ether (3)。上述化合物結構是由核磁共振儀、紅外線光譜儀、紫外光可見光譜儀、x-ray光譜儀和質譜儀等數據，以及比對相關化合物的文獻來分析確認。 化合物1-3進行體外抗發炎活性測試，並且探討化合物對脂多糖 (lipopolysaccharide, LPS) 誘發的小鼠巨噬細胞 (RAW264.7) 所產生的發炎性蛋白質一氧化氮合成酶 (iNOS) 以及第二型環氧化酶 (COX-2)。"
動物學科,蚊幼蟲與搖蚊幼蟲在水中分布與其血紅蛋白基因表現之關係,蚊幼蟲,呼吸,血紅蛋白,蚊蟲呼吸透過氣管系統，本研究假設底棲孑孓與搖蚊幼蟲具備血紅蛋白系統以擷取氧氣。戶外採集8種孑孓和1種搖蚊幼蟲，錄影觀察白腹叢蚊、竹生翠蚊和鹽埕搖蚊幼蟲長時間停留底層；家蚊、斑蚊則反覆上下至水面呼吸。顯微鏡下發現白腹叢蚊幼蟲體壁內側充滿紅點，色澤隨著富氧或缺氧而變化；然二種斑蚊則不明顯。PCR增殖6種蚊蟲和1種搖蚊血紅蛋白基因片段並建構親緣關係樹。定量RT-PCR顯示，白腹叢蚊與鹽埕搖蚊在缺氧條件下，血紅蛋白相對表現量分別增加5倍和150倍，上層埃及斑蚊和白線斑蚊則增加3.9倍和1.5倍。西方墨點法證實孑孓缺氧條件下，17-kDa血紅蛋白皆有大量表現。本研究首次確定6種蚊蟲具血紅蛋白基因，證明孑孓血紅蛋白基因在缺氧下的表現量增加，包括mRNA與蛋白質。此等反應氣候變遷，暖化導致水溫升高與低溶氧條件下，蚊蟲可能有因應環境改變的呼吸機制。未來將進一步標幟血紅蛋白在蚊幼蟲體內組織之表現與其他環境變因之影響。
動物學科,Super「鼠」跑,高血壓,腦發炎,腦功能障礙,透過文獻探討已知高血壓會引起腦發炎，導致腦功能受損。研究結果也顯示運動能增進腦部功能。因此，在此實驗中，我們想要探討高血壓引起的腦發炎和功能退化等問題能否透過運動改善。將鼠分為 2K1C 手術誘發高血壓組(2K1C)及沒有高血壓(Sham)的對照組，並再各分為運動組(Sham-EX、2K1C-Ex)和不運動組(Sham、2K1C)。小鼠腦部切片中微小膠細胞數量顯示 2K1C 的小鼠組別腦發炎最為嚴重，且 HE 染色發現一樣為 2K1C 小鼠組別的神經細胞數目最少。接著我們以莫里斯水迷宮測試小鼠學習、記憶功能，結果 ShamEx 及 2K1C- Ex 尋獲平台時間皆有減少趨勢，而 2K1C 尋獲平台花費最長時間，顯示運動確實可以減緩高血壓造成的腦功能受損。
動物學科,水熊蟲於化學環境壓力耐受機制探討,大生熊蟲,化學環境壓力,模式生物,常見模式生物檢測化學環境壓力後無法重複使用。本研究探討對環境變化敏感的大生熊蟲抗化學環境壓力機制，評估其作為重複使用模式生物可行性。得知多數大生熊蟲於硝酸鹽、酸鹼值改變與殺蟲劑環境壓力下仍能活動或隱生。以亞甲藍簡易染色可確認化學環境壓力下大生熊蟲是否受傷害，如體表角質層被破壞會導致完全染色。分析大生熊蟲於常見硝酸鹽環境壓力下體內脂質含量、總蛋白質單體表現量與總抗氧化能力，推測出大生熊蟲對抗硝酸鹽環境壓力機制：1.藉由> 20 kDa持續性活化蛋白抗硝酸鹽環境壓力。2.活動大生熊蟲增加體內脂質含量隔絕環境硝酸鹽。3.隱生大生熊蟲以抗氧化系統降低硝酸鹽產生的氧化壓力傷害。以上結果得知大生熊蟲具潛能檢測常見化學環境壓力並作為重複檢測之模式生物。未來將持續評估大生熊蟲可檢測的化學環境壓力並為人類健康把關。
動物學科,高鹽飲食對果蠅學習與記憶能力的影響及其細胞與分子機制,高鹽食物,學習與記憶,果蠅,"先前論文指出高鹽飲食會造成果蠅睡眠間斷(Jiayu Xie et al., 2019)、減短果蠅壽命(DengTai Wen et al., 2020)。而另一篇論文則以小鼠作為實驗對象，發現高鹽飲食會影響小鼠記憶和學習能力(Giuseppe Faraco et al., 2018)。根據上述，高鹽飲食在不同生物中可能影響神經系統的功能，但果蠅學習與記憶能力的影響還未被探討。因此，筆者以果蠅作為模式生物，研究高鹽飲食對其學習與記憶功能是否障礙及實驗其可能的細胞與分子機制。在將野生型果蠅進行測試後，選擇了Canton-S做後續實驗，並發現餵食Canton-S 四天的高鹽食物後學習及短期記憶表現下降，而進行實驗確認是由高鹽飲食導致此障礙，再研究了一系列相關研究。 本次實驗中，首次以餵食高鹽食物對果蠅學習與記憶障礙方面進行研究，並了解到高鹽飲食也會讓果蠅產生學習與短期記憶能力障礙。目前為了找出真正的細胞與分子機制提出可使用的方法，在實驗其他可能的機制。"
動物學科,在壓力下更要堅強，探討ACE2/Ang(1-7)軸與韌力的關係,韌力,壓力,ACE2/Ang (1-7)軸 ,"背景：韌力 (resilience)指個體遭受壓力時快速調適及復原的能力，是許多疾病的保護因子但生理機轉仍不明。Angiotensin-converting enzyme 2/Angiotensin(1-7) [ACE2/Ang(1-7)]軸具有保護心血管、抗焦慮及保護神經的潛力。目前仍無ACE2/Ang(1-7)軸與韌力相關的研究。另外ACE2是SARS-CoV-2病毒進入人體的受體，相關研究在疫情下更顯重要。 目的：本研究中我們以習得無助行為模式篩選具韌力行為的大鼠(resilient, R)，探討韌力鼠與非韌力鼠(non-R) ACE2/Ang(1-7)軸表現的差異。     假說：韌力鼠的ACE2/Ang(1-7)軸活性較非韌力鼠高。     結果：韌力鼠在壓力下其corticosterone (CORT)濃度與控制組無差異。韌力鼠的Ang(17)濃度較非韌力鼠及控制組高，暗示較高的Ang(1-7)濃度與韌性表現相關。以Ang(17)/Angiotensin II (Ang II)比率作為反映ACE2 轉化Ang(1-7) 功能的指標，發現韌力鼠的ACE2濃度及功能均與未主動逃跑而受電擊的時間相關，暗示其ACE2活性能因應壓力調控上升。韌力鼠的ACE2濃度雖較非韌力鼠低，但其ACE2功能則較其他兩組高。並且，Ang (1-7)濃度及ACE2功能僅在韌力鼠與ACE2濃度呈現正相關，但在非韌力鼠則無相關。暗示在壓力下韌力鼠的ACE2仍維持有效率的功能但非韌力鼠的ACE2功能則受影響。另一方面，Ang (1-7)濃度僅在非韌力鼠與CORT濃度負相關，暗示非韌力鼠個體的ACE2/Ang (17)]軸活性與海馬迴-下視丘-腦下垂體(HPA)軸的活性可能相關。  結論：韌力個體的ACE2/Ang (1-7)軸活性較非韌力鼠及控制組佳且可能因應壓力而調節增加。相反的，非韌力鼠個體的ACE2/Ang (1-7)軸功能較差且可能與HPA軸的活性相關。我們的研究顯示ACE2/Ang (1-7)軸扮演調節韌力的重要角色。ACE2/Ang (1-7)軸活性是否可以做為個體韌力的指標或具有增進韌力的臨床價值需進一步研究。"
動物學科,魚類在面對酸逆境下醣類的代謝差異,環境酸化,醣類代謝,,溫室氣體產生造成環境變遷，使得水質酸化，進而影響生態系統。生存在水中的魚類，為了適應水質的酸化，他們的生理上必定有一些變化。為了找出魚類適應酸化環境所做出的改變，我們選擇以斑馬魚及青鱂魚做為實驗動物以研究水質酸化對於其代謝之影響，分析其中與能量代謝及合成相關的器官，包含消耗大量能量的以維持酸鹼平衡的鰓、能量供應相關的肝臟和肌肉。綜合即時聚合酶連鎖反應及免疫螢光染色的結果，我們發現斑馬魚在面對酸性環境下時醣類代謝的情形是有改變的，肝臟內肝醣分解及糖質新生的效率提升，且鰓部位醣類代謝效率提升，推測是運送葡萄糖給鰓部位進行排酸代謝，其鰓部位細胞內的酵素也因此出現了細胞分工的現象。而青鱂魚在面對酸性環境下時，透過肝醣分解提供更多的葡萄糖進行糖解作用，同時抑制了糖質新生反應效率，推測其演化出了高效率的排酸方法。相較於斑馬魚，青鱂魚醣類代謝不會產生過多的能量，也意味著青鱂魚能量使用效率有提升。
植物學科,探討SAP5基因3端非轉譯序列對表現量的影響,SAP5基因,3端非轉譯序列,NMD機制,AtSAP5是阿拉伯芥中壓力相關蛋白(Stress Associated Protein)的成員之一，其表現與鹽分、乾旱、滲透壓、病毒等壓力相關。已知 SALK053644 突變株的SAP5表現量上升，此突變株的T-DNA嵌入於SAP5的3’UTR，我提出的假設是T-DNA破壞了他原本長3’UTR的NMD特性，造成SAP5的表現量改變。本研究將SAP5的3’UTR引入報導基因GFP中，利用菸草的短暫性表現了解不同3’UTR對於表現量的影響。本研究定序了T-DNA嵌入在SALK053644的位置，研究結果顯示SAP5的3’UTR受到NMD機制調控，而SALK053644的T-DNA上有一個新的SAP5多腺苷酸化位點，使用此位點的mRNA可能不會被NMD機制所降解，進而造成SAP5表現量上升。我提出三種可能的模式來解釋這樣的現象，分別是(1)T-DNA造成SAP5轉錄量上升，(2)T-DNA改變多腺苷酸化位點的使用，(3)T-DNA破壞SAP5 3’UTR後方的NMD特徵，相關的研究發現有助於了解可能影響SAP5基因表現之調控因素，也指出未來的研究方向。
植物學科,「洞」「築」先機—預先戳洞提升綠豆耐鹽能力,戳洞,鹽逆境,植物防禦,閩南語有句俗諺：「打斷手骨顛倒勇」，人能在受傷後成長，越挫越勇，那植物呢？本研究發現，綠豆葉片在預先接受戳洞的物理刺激後，對生長不僅不會造成負面影響，更反而能提升綠豆耐鹽能力！隨著戳洞數增加或是延長戳洞後放置時間，皆能增強綠豆的耐鹽能力。深入研究結果顯示，戳洞刺激可能藉由鈣離子作為訊號傳遞分子，最終提升綠豆體內抗氧化酵素活性，藉此降低植物在逆境下的氧化傷害，提升其耐鹽能力。未來期望能將研究成果推廣至農業應用上，使其在面對天災人禍時，可以減少農損。
植物學科,纖維素內切酶GsCelA自我斷裂之探討,纖維素內切酶,蛋白質修飾,自我斷裂,生質能源製程中，常將植物細胞壁中的纖維素進行水解，此反應在高溫環境中進行較具商業優勢，故開發耐高溫的纖維素酶具重要性。發現自嗜熱菌Geobacillus sp. 70PC53的纖維素內切酶GsCelA 在高溫中具高活性。初步研究發現 GsCelA 蛋白質序列 N 端後第 315 和第 316 個胺基酸間會發生自我斷裂現象，導致酵素活性及熱穩定性提升。本實驗在 GsCelA 的 N 端及 C 端分別製造定點突變，探討 GsCelA 自我斷裂性質。實驗結果顯示突變GsCelA 自我斷裂速率較低，而 EDTA 可抑制自我斷裂現象；已斷裂 GsCelA 可催化自我斷裂發生，而 N 端突變之已斷裂 GsCelA 不具此性質。整體實驗結果顯示GsCelA 自我斷裂受已斷裂GsCelA 催化且為一正回饋機制，並且本次的N端突變區段在催化GsCelA自我斷裂作用上是必要的。
植物學科,以菸草探討電擊對植物免疫的影響,電擊,水楊酸,植物免疫,農作物常遭受病毒攻擊，造成重大經濟損失，但傳統的化學藥劑無法有效抑制病毒，且易殘留汙染環境。本研究旨在利用物理性的電擊模擬外界刺激，進而探討電擊對植物啟動水楊酸主導免疫反應的影響電擊菸草10分鐘，能使圓葉菸草(。實驗中以Nicotiana benthamiana ) 10伏特的電壓的水楊酸標誌基因PATHOGENESISRELATED PROTEIN 1 (tobacco mosaic virus ; TMV)所主導的免疫反應，( PR1 )表現量提升，並使菸草鑲嵌病毒的感染斑點數下降。顯示電擊處理可以誘導水楊酸並增強整體抗病毒性。另外，相較於未電擊過的菸草，電擊後的菸草系統葉在接種TMVGFP後PR1基因表現量提升，表示電擊可能對菸草系統性水楊酸相關抗性表現產生預起效應來的病毒感染。
植物學科,探討豬籠草捕蟲籠的組織結構、發育吸收與物理結構,豬籠草,無柄腺,籠蔓,紅瓶豬籠草的捕蟲構造是由膨大後的葉柄固定在莖上，再由葉柄下凸的維管束及扁平處的維管束內縮向前端延伸發育成籠蔓，緊接著籠蔓的前端再膨大並經由細胞凋亡特化出類圓筒型、封閉的「空心葉」，最後特化出無柄腺鑲嵌在內層細胞上負責分泌、消化、吸收。無柄腺旁的原生質絲直徑較一般植物大5-10倍，幫助吸收。由於籠蓋不能閉合，下雨天時籠內物質容易傾倒，豬籠草演化出「來者不拒」的捕食策略。除了紅色食用色素和無機物以外，不管是含氮物、水溶性、酯溶性小分子皆吸收，甚至連蔗糖及大分子的澱粉、蛋白質，都以耗能的胞吞作用吸收，這與捕蠅草只吸收小分子的含氮物質及酯溶性的物質不同。而懸吊捕蟲籠的籠蔓，可以比自身重35倍的超強支撐力，維持捕蟲籠開口向上不傾倒溢出，保持較高的自然盛載量，提升捕食競爭力。
植物學科,槭樹翅果成熟過程中單、雙翅差異性探討,槭樹翅果,飛行傳播,成熟過程,具翅植物是一種成功適應散播的果實。槭樹果實會成對的在樹上生長，並在成熟後分開單獨落下。本研究欲了解槭樹果實成熟過程中的各階段變化、以及探討翅果單、雙翅在傳播效率上的差異性，並配合物理方面的分析。實驗結果發現單翅果之水平位移量、滯空時間、角速度皆較雙翅果大，且會受到康達效應作用，以終端速度掉落，雙翅果呈等加速度運動，故在傳播效率方面單翅果優於雙翅果。而在成長過程中槭樹翅果一開始是由合生心皮雌蕊發育而來，在成熟後產生離層，只透過心皮間柱與枝條相連，之後當心皮間柱斷裂時，雙翅果分離形成單翅果。由雙翅果較低的角速度推測其在生長過程中較為穩定。本實驗了解了槭樹翅果單翅及雙翅在不同時期對繁衍的優勢。
